{
  "$schema": "https://json-schema.org/draft/2020-12/schema",
  "title": "Event@v2",
  "type": "object",
  "required": ["id", "timestamp"],
  "properties": {
    "id": { "type": "string", "pattern": "^[a-z0-9][a-z0-9-]{2,}[a-z0-9]$" },
    "summary": { "type": "string" },
    "description": { "type": "string" },
    "timestamp": { "type": "string", "format": "date-time" },
    "tags": { "type": "array", "items": {"type":"string"} },
    "led_to": { "type": "array", "items": { "type":"string" } },
    "snippet": { "type": "string" },
    "x-extra": { "type": "object", "additionalProperties": true }
  },
  "additionalProperties": true
}
