{
  "id": "pan-e10",
  "summary": "Lithium supply shock drives battery cost +25 %",
  "description": "Spot prices for lithium carbonate surged 25 % in Q2 2025 after Chile announced export caps, pressuring Panasonic’s EV-battery margins. No mitigation decision has been taken yet.",
  "timestamp": "2025-05-02T09:00:00Z",
  "tags": ["supply_chain", "raw_material"],
  "led_to": [],
  "snippet": "Lithium costs jumped 25 % after Chile’s export cap announcement.",
  "x-extra": {}
}
