{
  "id": "phil-e3",
  "summary": "LED component costs fall 60% since 2009",
  "description": "Internal supply\u2011chain analysis showed LED package costs had decreased by 60\u202f% between 2009 and 2013, improving gross margins.",
  "timestamp": "2013-03-01T08:00:00Z",
  "tags": [
    "cost_reduction",
    "technology"
  ],
  "led_to": [
    "philips-healthtech-focus-2018"
  ],
  "snippet": "Component costs down 60\u202f%.",
  "x-extra": {}
}