{
  "id": "pan-e4",
  "summary": "Board approves AU Automotive acquisition",
  "description": "In April\u202f2014, Panasonic's board green-lit the \u20ac1.2\u202fbn purchase of AU Automotive.",
  "timestamp": "2014-04-01T14:00:00Z",
  "tags": [
    "m_and_a",
    "automotive_electronics"
  ],
  "led_to": [
    "panasonic-automotive-infotainment-acquisition-2014"
  ],
  "snippet": "\u20ac1.2\u202fbn for AU Automotive.",
  "x-extra": {}
}