{
  "id": "pan-e5",
  "summary": "EU clears AU Automotive deal",
  "description": "EU regulators gave antitrust approval for Panasonic\u2019s AU Automotive acquisition in July\u202f2014.",
  "timestamp": "2014-07-20T12:00:00Z",
  "tags": [
    "regulatory",
    "deal_closure"
  ],
  "led_to": [
    "panasonic-automotive-infotainment-acquisition-2014"
  ],
  "snippet": "Regulatory sign-off received.",
  "x-extra": {}
}