{
  "id": "pan-e8",
  "summary": "AI supply-chain pilot cuts inventory 15%",
  "description": "A March\u202f2019 pilot of Panasonic\u2019s AI platform yielded a 15\u202f% reduction in warehoused stock.",
  "timestamp": "2019-03-22T08:00:00Z",
  "tags": [
    "pilot",
    "ai_optimization"
  ],
  "led_to": [
    "panasonic-ai-supply-chain-2019"
  ],
  "snippet": "Inventory down 15\u202f%.",
  "x-extra": {}
}