{
  "id": "pan-e1",
  "summary": "Tesla Roadster launch proves EV viability",
  "description": "The December\u202f2009 launch of the Tesla Roadster demonstrated electric cars could match performance of ICE vehicles.",
  "timestamp": "2009-12-17T09:00:00Z",
  "tags": [
    "market_validation",
    "ev_trend"
  ],
  "led_to": [
    "panasonic-tesla-battery-partnership-2010"
  ],
  "snippet": "Roadster hits 0\u201360\u202fmph in 3.7\u202fs.",
  "x-extra": {}
}