{
  "id": "phil-e7",
  "summary": "Healthcare segment outperforms in Q2\u202f2018",
  "description": "Philips' Q2\u202f2018 earnings showed the health technology segment grew revenues by 12\u202f%, outpacing legacy units.",
  "timestamp": "2018-07-25T07:30:00Z",
  "tags": [
    "earnings",
    "segment_growth"
  ],
  "led_to": [
    "philips-healthtech-focus-2014"
  ],
  "snippet": "Health\u2011tech up 12\u202f% QoQ.",
  "x-extra": {}
}