{
  "id": "phil-e2",
  "summary": "Samsung and LG surpass 40% global TV share",
  "description": "Market share data showed Samsung and LG jointly captured over 40\u202f% of global TV shipments, signaling dominance by scale players.",
  "timestamp": "2011-03-25T11:00:00Z",
  "tags": [
    "competitive_pressure",
    "market_share"
  ],
  "led_to": [
    "philips-exit-tv-2011"
  ],
  "snippet": "Samsung & LG take 40\u202f%+ share.",
  "x-extra": {}
}