{
  "id": "pan-e12",
  "summary": "IBM pilots Watson for supply-chain optimization",
  "description": "In November 2018, IBM began a Watson-based supply-chain pilot with several automotive OEMs to improve demand forecasting accuracy and reduce inventory waste.",
  "timestamp": "2018-11-10T09:00:00Z",
  "tags": [
    "competitor_insight",
    "market_context"
  ],
  "led_to": [
    "panasonic-ai-supply-chain-2019"
  ],
  "snippet": "IBM tests Watson AI to boost forecasting accuracy.",
  "x-extra": {
    "pilot_partners": ["OEM-A", "OEM-B"]
  }
}
