{
  "id": "phil-e8",
  "summary": "Analysts initiate coverage on Philips as health\u2011tech pure play",
  "description": "Several brokerages upgraded Philips to 'buy' following the spin\u2011off, citing strong health\u2011tech market fundamentals.",
  "timestamp": "2018-08-20T11:00:00Z",
  "tags": [
    "analyst_upgrade",
    "positioning"
  ],
  "led_to": [
    "philips-invest-mri-2020"
  ],
  "snippet": "Initiate 'buy' on health\u2011tech focus.",
  "x-extra": {}
}