{
  "id": "phil-e4",
  "summary": "EU energy directives boost LED demand",
  "description": "The EU announced phase\u2011outs for halogen bulbs by 2016, accelerating commercial adoption of LED lighting solutions.",
  "timestamp": "2013-04-10T10:15:00Z",
  "tags": [
    "regulation",
    "demand_signal"
  ],
  "led_to": [
    "philips-healthtech-focus-2018"
  ],
  "snippet": "EU to phase\u2011out halogens.",
  "x-extra": {}
}